{
  "$schema": "https://json-schema.org/draft/2020-12/schema",
  "$id": "https://deepfield.dev/content/maps.schema.json",
  "title": "maps",
  "type": "object",
  "additionalProperties": false,
  "required": [
    "$schema",
    "table",
    "generated",
    "rows"
  ],
  "properties": {
    "$schema": {
      "const": "deepfield-content/1"
    },
    "table": {
      "type": "string"
    },
    "generated": {
      "type": "string"
    },
    "sourceSha": {
      "type": "string"
    },
    "rows": {
      "type": "array",
      "items": {
        "type": "object",
        "additionalProperties": false,
        "required": [
          "id"
        ],
        "properties": {
          "id": {
            "type": "string"
          },
          "order": {
            "type": "integer"
          },
          "totalWaves": {
            "type": "integer"
          },
          "fieldMeters": {
            "type": "array"
          },
          "conditionSchedule": {
            "type": "object"
          },
          "vehicles": {
            "type": "array"
          },
          "bossRated": {
            "type": "boolean"
          },
          "lesson": {
            "type": "string"
          },
          "tiers": {
            "type": "array"
          },
          "legacyLevelFile": {
            "type": "string"
          }
        }
      }
    }
  }
}
